{
  "schema": "shipping-harness/mcp-surface-v1",
  "protocolVersions": [
    "2026-07-28",
    "2025-11-25"
  ],
  "tools": [
    "shipping_start",
    "shipping_approve_scope",
    "shipping_execute",
    "shipping_status",
    "shipping_pause",
    "shipping_fix_blockers",
    "shipping_verify",
    "shipping_close"
  ],
  "resources": [
    "shipping://current/status",
    "shipping://current/contract",
    "shipping://current/blockers",
    "shipping://current/evidence",
    "shipping://current/backlog"
  ],
  "rootFixedAtStart": true,
  "arbitraryCommandInput": false,
  "publicListener": false
}
